[
	{
		"title": "Go Budget",
		"description": "GoBudget is a personal monthly budget planner I made with my friend: log your income and up to four expenses and get a live allocation breakdown, totals, and an over-budget warning — saved per-user to Supabase.",
		"tags": ["React", "Vite", "Webapp"],
		"demo_url": null,
		"github_url": "https://github.com/Dooooooks/GoBudget",
		"cover_url": "/ProjectPictures/GoBudget.png",
		"date": "2024-11"
	},
	{
		"title": "Barangay Together",
		"description": "This is a PHP + Supabase web app that lets barangay officials post volunteer activities and residents sign up, with role-based accounts, slot limits, and participation tracking.",
		"tags": ["PHP", "Webapp", "UI/UX"],
		"demo_url": null,
		"github_url": "https://github.com/Dooooooks/BarangayTogether",
		"cover_url": "/ProjectPictures/BarangayTogether.png",
		"date": "2025-03"
	},
	{
		"title": "Omaclippr - Plugin for Omarchy",
		"description": "Background instant replay buffer to capture your best gaming moments and desktop highlights on demand.",
		"tags": ["Linux", "Omarchy", "Shell"],
		"demo_url": null,
		"github_url": "https://github.com/Dooooooks/omaclippr",
		"cover_url": "/ProjectPictures/Omaclippr.png",
		"date": "2026-09"
	},
	{
		"title": "Palworld Dedicated Server using Google VPS",
		"description": "Administered the server via an Ubuntu/Debian headless environment using systemd services and automated shell scripts for scheduled restarts, backups, and memory management.",
		"tags": ["Server Creation", "Server Maintenance"],
		"demo_url": null,
		"github_url": null,
		"cover_url": "/ProjectPictures/PalworldServer.png",
		"date": "2026-07"
	},
	{
		"title": "Flappy Bird Clone (Godot Engine)",
		"description": "Developed a Flappy Bird clone featuring custom physics, precise collision detection, and an intuitive UI to recreate smooth, responsive gameplay.",
		"tags": ["Game Development", "Godot"],
		"demo_url": "https://hoyyyyyy.itch.io/donttouchmybirdie",
		"github_url": null,
		"cover_url": "/ProjectPictures/FlappyBirdClone.png",
		"date": "2024-06"
	},
	{
		"title": "Been Here Before (Godot Engine)",
		"description": "Built an immersive 2D psychological horror title inspired by The Exit 8 as part of a game jam team, providing hands-on experience in cooperative design and execution under tight deadlines.",
		"tags": ["Game Development", "Godot"],
		"demo_url": "https://hoyyyyyy.itch.io/been-here-before",
		"github_url": null,
		"cover_url": "/ProjectPictures/BeenHereBefore.png",
		"date": "2025-10"
	},
  {
    "title": "Seall (Android App)",
		"description": "Seall makes order taking, stock tracking, and profit calculations effortless for small baking businesses. Track customer orders, monitor live inventory, and keep tabs on pending balances all in one clean and fast app.",
		"tags": ["App Development", "Android", "Kotlin"],
		"demo_url": "https://drive.google.com/file/d/10aou8WdZtsDtOP4U3ZLc-HkPXv5YYpZQ/view?usp=sharing",
		"github_url": null,
		"cover_url": "/ProjectPictures/Seall.png",
		"date": "2026-09"
  }
]
